,id,allegation,evaluation,T5,BERT,BART,XLNet,GTP2
0,1650725457.801289,"Valentine's Day was invented by greeting card companies.
",false,the holiday falls yearly on february 14. some believe it is a religious holiday centered around a saint named Valentine. the holiday was invented by greeting card companies to make people feel like crap.,And he called her his “very gentle Valentine.” She first advertised her business in 1852.”,"The idea that Valentine’s Day, which falls yearly on Feb. 14, was a cynical gambit by greeting card companies, came with a line of dialogue in the 2004 Jim Carrey/Kate Winslet romance “E",And he called her his “very gentle Valentine.” She first advertised her business in 1852.”,And he called her his “very gentle Valentine.” She first advertised her business in 1852.”
1,1650725541.455927,"A video shows truckers from South Carolina on their way to join a ""Freedom Convoy"" in Canada. 
",miscaptioned,video shows truckers from south carolina in the u.s. on their way to join the protest. many people assumed the video was related to the trucker protest in canada. bottomley says the video had nothing to do with convoys headed to canada.,,"In January 2022, as hundreds of truckers drove across Canada in a “Freedom Convoy” to protest COVID-19 vaccine mandates, a video started circulating online that supposedly showed truckers from South Carolina in the United States",,
2,1650725359.841572,"An online advertisement revealed an unusual or unique tip or trick for cars with automatic headlights.
",false,"for at least several years, online advertisements have made the claim that there’s an unusual or unique tip or trick for cars with automatic headlights. one ad read: “Unique Trick If Your Car Has Automatic Headlights.” another said: “An Unusual Tip If Your Car Has Automatic Headlight","Azrieli Center, 26 Harokmim St., Holon, Israel.”","For at least several years, online advertisements have made the claim that there’s an unusual or unique tip or trick for cars with automatic headlights. One ad read: “Unique Trick If Your Car Has Automatic Headlights.�","Azrieli Center, 26 Harokmim St., Holon, Israel.”","Azrieli Center, 26 Harokmim St., Holon, Israel.”"
3,1650725367.087319,"Russia bombed a Biden-owned villa and several U.S. biolabs in Ukraine. 
",false,a fictitious article falsely claimed a villa owned by u.s. president Joe biden was bombed by the Russian military. david frum: real raw news does not traffic in genuine news stories. he says the site hosts fictional pieces that play on right-wing conspiracy theories.,Real Raw News is not a genuine news source. None of these stories is based in reality.,"In March 2022, as Russia continued its attack on Ukraine, the website “Real Raw News” published a fictitious article that falsely claimed a villa owned by U.S. President Joe Biden was bombed by the Russian military.",Real Raw News is not a genuine news source. None of these stories is based in reality.,Real Raw News is not a genuine news source. None of these stories is based in reality.
4,1650750681.788327,"In September 2021, an initial news release announcing U.S. Rep. Lauren Boebert's impeachment articles again President Joe Biden and Vice President Kamala Harris included the misspelled slogan ""IMEACH BIDEN.""
",true,"a typo appeared to suggest that first-term congresswoman Lauren Boebert had prepared articles of impeachment against both biden and vp Kamala Harris. a second version of the announcement, with the spelling of the word “impeach,” was quickly issued.",,"In September 2021, some internet users gleefully shared screenshots that appeared to suggest controversial first-term Congresswoman Lauren Boebert, R-Colorado, or more likely her staff, had included an embarrassing typo in her initial announcement that she had",,
5,1650750888.573073,"A ""Stanford/NIH"" study concluded that face masks worn to prevent COVID-19 transmission do not work.
",false,"the journal Medical Hypotheses publishes extremely speculative notions without the burden of “traditional” peer review. in November 2020, that journal published a paper that argued using face masks to prevent COVID-19 transmission does not work. the paper has been billed as authoritative empirical evidence against mask use",Read the latest fact checks about the vaccines.,"“We’re still fighting an “infodemic” of rumors and misinformation surrounding the COVID-19 pandemic, and you can help. Find out what we’ve learned and how to inoculate",Read the latest fact checks about the vaccines.,Read the latest fact checks about the vaccines.
6,1652286296.214729," Pfizer Inc. admitted in documents released by the Food and Drug Administration, as part of a Freedom of Information Act request, that the COVID-19 vaccine was unsafe to get during pregnancy.  
",false,claim is based on a years-old screenshot from the MHRA website. this warning about pregnant women taking the vaccine has been revised since it was first published in December 2020. health authorities in Britain and the united states continue to recommend the vaccine for both pregnant and breastfeeding women.,,This claim is based on a years-old screenshot from Britain’s Medicines and Healthcare Products Regulatory Agency (MHRA) website that was not included in any “Pfizer docs.” This warning about pregnant women,,
7,1650750854.856527,"In 1527, Martin Luther wrote of the Black Death: ""I shall ask God to mercifully protect us""; and ""I shall not avoid person or place but will go freely.""
",correct-attribution,"a quote attributed to the 16th-century german theologian, martin luther, gained prominence during the COVID-19 pandemic. luther: if God should wish to take me, he will surely find me, and i have done what he expected",Read the latest fact checks about the vaccines. Whether One May Flee From a Deadly Plague.”,"Snopes is still fighting an “infodemic” of rumors and misinformation surrounding the COVID-19 pandemic, and you can help. Find out what we’ve learned and how to inoculate yourself against CO",Read the latest fact checks about the vaccines. Whether One May Flee From a Deadly Plague.”,Read the latest fact checks about the vaccines. Whether One May Flee From a Deadly Plague.”
8,1650750707.317591,"In late August 2021, Vice President Kamala Harris mistakenly laid a wreath commemorating John McCain at a memorial in Hanoi that supposedly celebrates the shooting down of his plane and his capture by the North Vietnamese.
",false,"in late august 2021, vp Kamala Harris visited a monument marking the spot where McCain’s plane was shot down in 1967. many online claimed that she had inadvertently paid tribute to the captors.",pic.twitter.com/m2YTjS443X — Luna Oi! ?? ¡,"In late August 2021, U.S. Vice President Kamala Harris visited Vietnam and conducted bilateral meetings with the prime minister and president, while on a trip across Southeast Asia. Three years after the passing of Sen. John McCain, who",pic.twitter.com/m2YTjS443X — Luna Oi! ?? ¡,pic.twitter.com/m2YTjS443X — Luna Oi! ?? ¡
9,1650725240.965843,"The Disney Corporation vowed to help repeal Florida’s “Don't Say Gay” bill, saying it “should never have passed and should never have been signed into law.”
",true,"the company has expressed that it will aid efforts in helping repeal the bill that will limit discussions of gender and sexuality in schools. florida’s HB 1557, also known as the ‘Don’t Say Gay’ bill, should never have passed and should never have been signed into law.",,"Disney Corp. has come out in opposition to Florida’s Parental Rights In Education bill, also described as the ‘Don’t Say Gay’ bill. After facing criticism from its employees for its initially quiet response",,
10,1650750797.424343,"In September 2021, the U.K. government announced its intention to create a new criminal offense of pet abduction.
",true,the new law will recognise the welfare of animals and that pets are valued as more than property. it is already illegal to steal pets in the uk.,,"In September 2021, several news outlets and websites reported that the U.K. government had announced its intention to create a new criminal offense of “pet abduction,” in response to a government taskforce report. On Sept.",,
11,1650725633.11374,"Emails promoting a ""Pfizer Treatment Survey"" promise ""$90 or more"" to participants.
",scam,"emails promoting a ""Pfizer Treatment Survey"" should be avoided and deleted. subject line would not read, ""–C00NFlRmaaTlONN–REeCEe1PT...–+eef”","Pfizer, the company, had nothing to do with it. Read the latest fact checks about the vaccines.","At some point during the COVID-19 pandemic, emails about a “Pfizer Treatment Survey” began landing in readers’ inboxes. Such messages promoted “$90 or more” in rewards for","Pfizer, the company, had nothing to do with it. If you get an email or text like this, STOP.","Pfizer, the company, had nothing to do with it. If you get an email or text like this, STOP."
12,1650725338.79959,"A color photograph shows a dime-sized hole drilled on Mars.
",true,"the mission of NASA’s Mars Curiosity rover is to determine whether the red planet was ever home to life, microbial or otherwise. a coin-sized hole was featured in a photograph posted in 2020 on reddit, where it received more than 120,000 upvotes.","As such, we have rated this claim “True.” Com/Redditspaceporn/Status/1499164064592719872.”",Curious about how Snopes’ writers verify information and craft their stories for public consumption? We’ve collected some posts that help explain how we do what we do. Happy reading and let us know what else you might be,"As such, we have rated this claim “True.” Com/Redditspaceporn/Status/1499164064592719872.”","As such, we have rated this claim “True.” Com/Redditspaceporn/Status/1499164064592719872.”"
13,1652433302.751328,"Oprah Winfrey died or suffered a tragedy in or before early May 2022. She also endorsed keto weight loss gummies that were created by Weight Watchers.
",false,"scammers sent misleading text messages in may 2022 that said, “Fans react to the Oprah tragedy.” the texts also included a link that led to a fraudulent page that claimed Oprah Winfrey had endorsed keto weight loss gummies. there’s no evidence that Oprah Winf",,"Scammers sent misleading text messages in May 2022 that said, “Fans react to the Oprah tragedy.” Those texts included a link that led to a fraudulent page that claimed Oprah Winfrey had endorsed keto weight loss gummies",,
14,1650750625.247954,"On Oct. 5, 2021, Snapchat launched a new feature that aims to help young users run for political office.
",true,"on Oct. 5, 2021, Snopes came across social media posts questioning if, or why, Snapchat was trying to encourage people to run for political office. the posts’ underlying claim — that the social media platform had rolled out a new feature — was true.",,"On Oct. 5, 2021, Snopes came across social media posts like the one displayed below questioning if, or why, Snapchat was trying to encourage people to run for political office.  The posts’ underlying claim —",,
15,1650750347.487769,"More than 20 African countries banded together to combat the spread of the Sahara Desert by planting a giant wall of trees to run across the continent. This wall will stretch for around 7,000 km coast to coast. 
",mostly-true,"the Great Green Wall (GGW) initiative plans to have trees extend like a belt across the Sahel region which is at the base of the Sahara. the wall of trees, the meme says, will spread 7,000 km across the continent from coast to coast. the project aims to have the wall extend from Sen",,An ambitious effort by a group of African countries to tackle the effects of climate change and desertification has been in the works since 2007. The Great Green Wall (GGW) initiative plans to have trees extend like a belt across the Sa,,
16,1650750352.861898,"You can get a notification on your iPhone if snow is coming.
",true,"iOS 15 is Apple’s software update released in September 2021. in order to receive the notifications, iPhone users have to enable them in their phones’ settings.",,"On Nov. 23, 2021, the British viral news site Unilad published an eyeball-grabbing headline, “Your iPhone Has A Hidden Setting That Will Tell You When It’s About To Snow.”",,
17,1650725351.587332,"A photograph shows Isabelle Boyer-Singer, the woman who modeled for the Statue of Liberty.  
",mostly-false,an image supposedly showing “Isabelle Boyer-Singer” was widely circulated on social media in march 2022. the above-displayed image was created by artist bas Uterwijk in 2021 as part of a series of “AI portraits” of historical figures.,,"In March 2022, an image supposedly showing “Isabelle Boye-Singer” was widely circulated on social media along with the claim that she was the original model for the Statue of Liberty:  This is not a",,
18,1657124079.226425,"In June 2022, Donald Trump marked the occasion of Father’s Day by posting an official statement in which he attacked political rivals, including Liz Cheney and Ron DeSantis.
",originated-as-satire,"fake father's day statement was a fabrication created by a left-wing group. it gave no inkling as to its true, original source, which was the twitter account @StandforBetter.",Our rating therefore is “Originated as Satire.”,"In June 2022, social media users critical of former U.S. President Donald Trump seized upon what appeared to be an unusual official statement in which he marked the occasion of Father’s Day by attacking his political rivals and boosting his",Our rating therefore is “Originated as Satire.”,Our rating therefore is “Originated as Satire.”
19,1650724469.790745,"Animals previously thought to be extinct were found alive in the ""lost city"" of La Ciudad Blanca, deep within a rainforest in Honduras.
",true,"in 2019, scientists conducted a survey of the lowland rainforest in Honduras. they rediscovered three species previously thought to have been extinct. tiger beetle, false tree coral snake and pale-faced bat were also discovered.",,"Deep in the heart of the Mosquitia rainforest in Honduras lies La Ciudad Blanca, the fabled White City said to have once been an ancient metropolis. Named for its large pillars of white stone, the existence",,
20,1650724494.781912,"Judge Ketanji Brown Jackson, who underwent Senate-confirmation hearings as a nominee for the U.S. Supreme Court in March 2022, presided over the “Pizzagate” case, in which a shooter targeted a pizzeria in Washington, D.C., in 2016.
",true,"ketanji brown Jackson was nominated to the supreme court in 2022. she presided over the controversial ""Pizzagate"" case in 2017. she has been mentioned more frequently in fringe online groups.",He was sentenced to four years in prison.,"Judge Ketanji Brown Jackson, nominated to the U.S. Supreme Court, presided over the controversial “Pizzagate” case in 2017. Since her Senate confirmation hearings in late March 2022, many online have been un",He was sentenced to four years in prison.,He was sentenced to four years in prison.
21,1650750378.872253,"The country of Iceland is mosquito-free.
",true,"aedes nigripes, the likeliest species to survive in Iceland, could not due to a range of factors. one mosquito was found in the country on a plane from greenland in 1986. the specimen was preserved in a jar of alcohol but appears to have been misplaced",,"An island free of mosquitoes sounds like the dream for those of us who hate their relentless buzzing, the itchy redness that results from being bitten, and bug spray. But it turns out that only a few places in the world possess",,
22,1650724439.180614,"Photos show Sen. Marsha Blackburn flashing a ""white power gesture"" during a Senate hearing (or vote) on the confirmation of Ketanji Brown Jackson to the Supreme Court.
",miscaptioned,"a picture was circulated on social media showing blackburn making a ""white power"" gesture. blackburn posted a video of herself questioning defense secretary and general. blackburn is the first black woman nominated to the high court.","In most cases, the OK symbol simply means “OK.”","In April 2022, a picture was circulated on social media that supposedly showed U.S. Sen. Marsha Blackburn, R-Tenn., making a “white power” gesture during a Senate hearing or vote to confirm Ketan","In most cases, the OK symbol simply means “OK.”","In most cases, the OK symbol simply means “OK.”"
23,1650725513.501652,"An email with a UPS logo and picture promise an exclusive reward for taking a 30-second survey.
",scam,"a survey scam email was created to look like an official message from the UPS. the email promised an ""exclusive reward"" for taking a ""30-second marketing survey"" however, this was a scam, and was not official correspondence from the company.",,"In February 2022, we reviewed a survey scam email that was created to look like an official message from the United Parcel Service, better known as UPS. The email with a UPS logo and picture looked to be a “confirmation",,
24,1650750365.445355,"""The Ellen DeGeneres Show"" is giving away $1,000 Amazon gift cards, PlayStation 5 consoles, and iPhones, all on Facebook.
",scam,"fake Facebook giveaways appeared on the pages of “the Ellen DeGeneres Show” in November 2021. the fake giveaways promised $1,000 Amazon gift cards, PlayStation 5 gaming consoles, and iPhones. one of the fake profiles showed signs it was potentially operated from Zambia.",,"In November 2021, Facebook posts showing pictures from “The Ellen DeGeneres Show” promised giveaway entrants $1,000 Amazon gift cards, PlayStation 5 gaming consoles, and iPhones. However, this was a scam. It also",,
25,1650750694.593847,"Black Lives Matter co-founder Patrisse Cullors used donations to the movement to buy a $1.4 million mansion.
",unproven,"black lives matter co-founder Patrisse Cullors purchased a home in topanga, california, for $1.4 million. the story sparked a tsunami of spinoff articles and commentary. the story sparked a cloud of doubt over the finances of the nonprofit",Cullors is a fairly high-profile public figure.,"On April 7, 2021, the real estate gossip website Dirt reported that Black Lives Matter co-founder Patrisse Cullors had purchased a home in Topanga, an eccentric neighborhood located in the western portion of Los Angeles, for $",Cullors is a fairly high-profile public figure.,Cullors is a fairly high-profile public figure.
26,1650750407.865378,"A photograph shows politicians flouting COVID-19 face-mask rules. 
",miscaptioned,"the 113th congress convened on January 3, 2013, welcoming 81 new Members to the house. john avlon: this meme uses a severely outdated picture to mislead people. avlon: you can help us fight an ""infodemic"" of rumors and misinformation",Read the latest fact checks about the vaccines.," Snopes is still fighting an “infodemic” of rumors and misinformation surrounding the COVID-19 pandemic, and you can help. Find out what we’ve learned and how to inoculate yourself against CO",Read the latest fact checks about the vaccines.,Read the latest fact checks about the vaccines.
27,1650750318.073773,"A Dec. 4, 2021, rally in Washington D.C. was staged or faked by federal agents or actors, rather than a real white nationalist group called Patriot Front. 
",false,"a white nationalist group known as Patriot Front marched at the Lincoln memorial in 2021. john avlon: figures from the american right sought to undermine the authenticity of the rally. avlon: it is indeed a real, earnestly organized white nationalist group.","As a result, we are issuing a rating of “False.” We did not receive any further responses.","In December 2021, members of a white nationalist group known as Patriot Front marched at the Lincoln Memorial and other parts of the National Mall in Washington, D.C., wearing face coverings and an improvised uniform of khaki pants and dark","As a result, we are issuing a rating of “False.” We did not receive any further responses.","As a result, we are issuing a rating of “False.” We did not receive any further responses."
28,1650750967.557243,"The creators of the cartoon series ""South Park"" want to buy Casa Bonita, the restaurant featured on the show.
",true,summit family restaurants filed for bankruptcy in 2021. the restaurant was shuttered due to the COVID-19 pandemic.,We want to make it right and make it amazing.”,"In 2003, a classic episode of the comedic cartoon series “South Park” launched a Colorado restaurant into infamy. The episode featured the show’s often-villainous Eric Cartman visiting his favorite restaurant — Cas",We want to make it right and make it amazing.”,We want to make it right and make it amazing.”
29,1650750509.375197,"A dinosaur bone described as the world’s largest tibia was discovered on an Illinois farm.  
",false,"a video shared to the platform on June 19, 2021, went viral after a man claimed to live in a small town in central illinois ""surrounded by cornfields"" the video had been liked more than 31,000 times. the original poster did not name the town in which the bone was reportedly discovered",It weighed somewhere between 25 and 81 tons. Then Thousands of People Started to Believe Him.”,"A TikTok video shared to the platform on June 19, 2021, went viral after a man who claimed to live in a small town in central Illinois “surrounded by cornfields” said that the world’s largest",It weighed somewhere between 25 and 81 tons. Then Thousands of People Started to Believe Him.”,It weighed somewhere between 25 and 81 tons. Then Thousands of People Started to Believe Him.”
30,1650750275.977093,"Two friends found pipes in the woods that led to something found underneath.
",true,"online ads have claimed: ""These Pipes Were Sticking Out of the Ground, This Is What Was Underneath"" the seemingly endless article used fictitious names like ""Mike Peter"" and ""Dale Hufford"" and appeared to dramatize the otherwise true story.","Sorry for my bad English, I’m trying my best.) Not something you want to read down there.","Since at least December 2021, online advertisements have claimed: “These Pipes Were Sticking Out of the Ground, This Is What Was Underneath.” Upon further inspection, they led to a 69-page slideshow article about","Sorry for my bad English, I’m trying my best.) Not something you want to read down there.","Sorry for my bad English, I’m trying my best.) Not something you want to read down there."
31,1650750905.369811,"""Vaccine bandits"" are forcing COVID-19 vaccinations onto unsuspecting people in Los Angeles. 
",false,"a video about ""vaccine bandits"" forcing COVID-19 vaccinations racked up millions of views on TikTok. the video was created as a joke, not as a genuine news report, says a user. a link to this alleged newspaper clipping led to a video","Read the latest fact checks about the vaccines. In other words, these scenarios are made up."," Snopes is still fighting an “infodemic” of rumors and misinformation surrounding the COVID-19 pandemic, and you can help. Find out what we’ve learned and how to inoculate yourself against CO","Read the latest fact checks about the vaccines. In other words, these scenarios are made up.","Read the latest fact checks about the vaccines. In other words, these scenarios are made up."
32,1650725436.947865,"Musician Pharrell Williams has listed his Beverly Hills mansion on Zillow for $17 million.
",outdated,"on Feb. 17, 2022, a post on reddit in the r/holup subreddit showed a screenshot of a tweet that read: ""Pharrell has listed his Beverly Hills mansion for $17 million."" the tweet was from March 2, 2020: Pharrell has listed his Beverly Hills man",,"On Feb. 17, 2022, a post on Reddit in the r/holup subreddit showed a screenshot of a tweet that read: “Pharrell has listed his Beverly Hills mansion for $17 million.” The joke was",,
33,1652433306.436989,"In a leaked majority opinion overturning Roe v. Wade, conservative Supreme Court justices argued that abortion should be banned or restricted in order to boost the “domestic supply of infants” for adoption.
",false,a leaked draft opinion overturning roe v. Wade has been viewed as a callous and inhumane argument for the restriction or prohibition of abortion access in the u.s.,,"In May 2022, as abortion-rights and anti-abortion activists digested and responded to a leaked majority Supreme Court opinion overturning Roe v. Wade, attention turned to what some presented as a callous and inhumane argument for the",,
34,1652286287.61726,"Tesla CEO Elon Musk offered $17 and a coupon for a free appetizer at Applebee’s to buy the “The View” talk show.
",false,"claim appeared to have originated as a joke in early may 2022. a picture of comedian Joy Behar and the words, ""Elon Musk issued a tender offer to buy ‘the View’ outright for $17 and a coupon for a free appetizer at Applebee’s"" spread as a meme",The origins of the meme remained unknown.,"This claim appeared to have originated as a joke in early May 2022. It spread as a meme on Facebook, perhaps leaving some users to wonder if Musk had earnestly, or jokingly, made the offer to buy “The View",The origins of the meme remained unknown.,The origins of the meme remained unknown.
