,id,allegation,evaluation,T5,BERT,BART,XLNet,GTP2
35,1650750339.432616,"An ""Omicron"" movie was made in the 1960s. 
",mixture,"a new variant of COVID-19 called ""omicron"" emerged in 2021. social media users started looking for old pieces of media containing the word so that they could claim that this variant had been ""predicted"" a 1963 sci-fi movie about an alien parasite that takes over the human body",Some even created and posted fake movie posters.,"The only thing the internet loves more than a good prediction is pretending that a good predictor exists. Since the start of the COVID-19 pandemic, we’ve seen some far-reaching attempts to claim that this contagious and",Some even created and posted fake movie posters.,Some even created and posted fake movie posters.
36,1657124145.79,"In a speech on June 9, 2022, U.S. Rep. Marjorie Taylor Greene said Jan. 6 Capitol attack defendants were having their rights “fragrantly” violated. 
",correct-attribution,"marjorie Taylor greene, r-ga., misspoke and clearly intended to use the word ""fragrantly"" john avlon: in 2022, a u.s. house of representatives Select Committee held hearings on the attack. avlon: greene","Pre-trial, they are sitting in that jail. “","Greene misspoke and clearly intended to use the word “flagrantly.”  In June 2022, as a U.S. House of Representatives Select Committee held public hearings on its investigation into the Jan. 6,","Pre-trial, they are sitting in that jail. “","Pre-trial, they are sitting in that jail. “"
37,1650750853.005903,"The late Kurt Cobain once argued that the nudity on the cover of the Nirvana album ""Nevermind"" could be covered with a sticker that read: ""If you're offended by this you must be a closet pedophile.""
",true,a 1991 photograph of a naked baby in a pool swimming after a dollar on a fishing hook was airbrushed out. late front man Kurt cobain reportedly replied by saying that they could censor it by placing a sticker over the baby’s genitals. this quote resurface,,"In 1991, as the cover art for Nirvana’s second studio album — a now iconic photograph of a naked baby in a pool swimming after a dollar on a fishing hook — was being prepared, there was some discussion about censoring",,
38,1652286308.41263,"A viral quote about how “the unborn are a convenient group of people to advocate for” was written by Pastor Dave Barnhart.
",correct-attribution,"a pastor at a church in Birmingham, Alabama, posted a message on his facebook page in 2018. john sutter: the unborn are the perfect people to love if you want to claim you love Jesus but dislike people who breathe. he says they are morally uncomplicated, unlike the",They all get thrown under the bus for the unborn.,"This quote truly originated with a 2018 social media post from Dave Barnhart, a pastor at Saint Junia United Methodist Church in Birmingham, Alabama.  In May 2022, after the leak of a Supreme Court draft opinion showed that the justices",They all get thrown under the bus for the unborn.,They all get thrown under the bus for the unborn.
39,1650725691.73178,"Clint Eastwood, Dr. Phil, and Fox News all endorsed Kraken Male Enhancement capsules.
",scam,"a scam promotion for a product called Kraken Male Enhancement featured fake endorsements from Clint eastwood, television personality Dr. Phil, and the cable news network. the ruse appeared to begin with Facebook ads.",The ruse appeared to begin with Facebook ads.,"Since at least December 2021, a scam promotion for a product called Kraken Male Enhancement featured fake endorsements from Hollywood actor Clint Eastwood, television personality Dr. Phil, and Fox News. The two celebrities and the cable news network were used without",The ruse appeared to begin with Facebook ads.,The ruse appeared to begin with Facebook ads.
40,1650725379.167554,"A news report on Russia's invasion of Ukraine showed a living person sitting up while in a body bag.
",miscaptioned,"video shows a reporter standing in front of dozens of body bags. as the clip goes on, one of the “dead bodies” in the background unzips the body bag and stands up. this isn't the first time this video has been miscaptioned.","kiev pic.twitter.com/64cxAJdGjI — Sk Boz, PhD ? ( In fact, it shows climate protesters in Austria.","During February 2022, as Ukrainian cities were shelled by Russian missiles, as tanks were hit by Molotov cocktails, and as the death toll from Russia’s invasion of Ukraine stretched into the thousands, a video started circulating on","kiev pic.twitter.com/64cxAJdGjI — Sk Boz, PhD ? ( In fact, it shows climate protesters in Austria.","kiev pic.twitter.com/64cxAJdGjI — Sk Boz, PhD ? ( In fact, it shows climate protesters in Austria."
41,1650724396.149609,"A video shows singer Taylor Momsen using parkour to escape from paparazzi in real life. 
",miscaptioned,a video supposedly showing singer Taylor Momsen escaping from paparazzi with a series of escalating parkour moves is frequently shared on social media. this video actually comes from a 2009 Nike commercial.,,This video was created for a Nike advertisement in 2009.  A video supposedly showing singer Taylor Momsen escaping from paparazzi with a series of escalating parkour moves is frequently shared on social media.  taylor momsen,,
42,1650725526.090498,"Punxsutawney Phil is an immortal groundhog. 
",legend,Punxsutawney Phil has been predicting the weather since 1886. the average groundhog only lives between three and six years. he drinks a secret elixir every summer that gives him seven more years of life.,He has been making predictions since 1886! Where does this “elixir of life” come from?,"On Feb. 2, 2022, Punxsutawney Phil, a weather predicting immortal groundhog that lives in a hole on Gobbler’s Knobb in Pennsylvania, crawled out of his burrow for the 136th time","He has been making predictions since 1886! That’s a 47% accuracy rate,” he said at the time.",He has been making predictions since 1886! Where does this “elixir of life” come from?
43,1650750660.950342,"An earthquake occurred while ""The Office"" was filming an episode and it was captured on video.
",true,"the earthquake was a genuine moment that was filmed during the fifth season of “the office” the scene was likely for the episode titled, “Weight Loss Part 2” the earthquake was the same 5.4 magnitude event that shook Southern California on July 29, 2008.",,"On Sept. 17, 2021, the @sometimesdoyouever TikTok account reposted a blooper video that showed an earthquake on the set of “The Office.” The set of The Office gets hit by",,
44,1650724407.507298,"A mugshot authentically shows a young Bill Gates after he was arrested in 1977 in Albuquerque, New Mexico, for running a stop sign and driving without a license.
",true,"the mugshot shows a young Gates in police custody in albuquerque, new mexico. Gates himself addressed the arrest that led to the mugshot in 2007. he was 22 at the time and looks all of 16 at the time.",He was 22 at the time and looks all of 16.,"Bill Gates, the billionaire co-founder of Microsoft, had a few run-ins with the law in his younger days, including one that led to an infamous mugshot that continues to haunt the internet today.  A post shared by",He was 22 at the time and looks all of 16.,He was 22 at the time and looks all of 16.
45,1650750861.025361,"""Rocky"" film star Sylvester Stallone kept the turtles from his 1976 film as pets.
",false,"in late August 2021, some social media users marveled at reports that actor Sylvester Stallone kept two turtles from the 1976 film he starred in, “Rocky,” as pets. in a 2019 Instagram post, Stallone said the turtles also were in the 2018 film “Cree",,"In late August 2021, some social media users marveled at reports that actor Sylvester Stallone kept two turtles from the 1976 film he starred in, “Rocky,” as pets — and that the two turtles are",,
46,1650750740.878819,"Putting tampons soaked in a liquid solution that includes ivermectin into vaginas is an effective and safe step to fight COVID-19. 
",false,"in mid-September 2021, Snopes became aware of the above-displayed tweet purportedly showing a Facebook thread where users discussed soaking tampons with the anti-parasitic drug ivermectin. the alleged discussion included a back-and-forth",Read the latest fact checks about the vaccines.," Snopes is still fighting an “infodemic” of rumors and misinformation surrounding the COVID-19 pandemic, and you can help. Find out what we’ve learned and how to inoculate yourself against CO",Read the latest fact checks about the vaccines.,Read the latest fact checks about the vaccines.
47,1650725676.19872,"The cast of ""Little People, Big World"" experienced a ""sudden loss.""
",outdated,the ad was posted on a Facebook page with a strange name: P-15897-2. it was described as a “clothing store” but was nothing more than a quickly-created page. it was likely managed from outside of the u.s.,It mentioned several tragic developments. She posted about his passing on Instagram.,"On Jan. 4, 2022, a strange Facebook ad appeared that claimed: “The Sudden Loss That Hit ‘Little People, Big World.'” It led to a lengthy article that claimed to reveal news of a death",It mentioned several tragic developments. She posted about his passing on Instagram.,It mentioned several tragic developments. She posted about his passing on Instagram.
48,1657123536.995215,"Videos on TikTok revealed U.S. Supreme Court Justice Clarence Thomas’ credit card number. 
",unproven,"social media users were posting messages, videos, and photos that allegedly contained the home addresses of six supreme court justices, Thomas, John Roberts, Samuel Alito, Neil Gorsuch, Brett Kavanaugh, and Amy Coney Barrett. a few days before this credit card rumor gained traction, social media",How did Kavanaugh’s credit card info leak? This can’t be real…is this what yall doing? #,"In June 2022, shortly after the U.S. Supreme Court issued a ruling that effectively overturned Roe V. Wade and ended the constitutional right to an abortion, rumors started to circulate on social media that Justice Clarence Thomas’ credit card",How did Kavanaugh’s credit card info leak? This can’t be real…is this what yall doing? #,How did Kavanaugh’s credit card info leak? This can’t be real…is this what yall doing? #
49,1652286291.854914,"Elon Musk once said: “I hate when people confuse education with intelligence. You can have a bachelor’s degree and still be an idiot.”
",misattributed,"on April 30, 2022, a Facebook user posted what appeared to be a screenshot of a tweet in which Tesla CEO Elon Musk said, “I hate when people confuse education with intelligence.” however, we were unable to find any record that he ever tweeted or said these words.",The next sentence discussed “intelligence.”,"While it’s possible that Musk might agree with the sentiment, the fact remains that we found no record of him ever saying or writing the words, and the same quote has been attributed to many other people, before and since.",The next sentence discussed “intelligence.”,The next sentence discussed “intelligence.”
50,1651670217.051622,"U.S. President Dwight D. Eisenhower said, “Don’t join the book burners. Don’t think you are going to conceal faults by concealing the evidence that they ever existed. Don’t be afraid to go into your library and read every book.”
",correct-attribution,"bob greene: a popular quote denouncing ""book burning"" attributed to dwight d. Eisenhower is correct. he says he urged graduates to look at their own country, even its imperfections, with honesty. greene: we have the disgrace of ra",,"It’s true that Eisenhower spoke those exact words during a commencement speech at Dartmouth College in 1953. It should be noted, however, that this very popular version of the passage has been truncated in such a way as to omit",,
51,1650750395.885188,"A 480-pound woman, Annabelle Gaston, was arrested on suspicion of involuntary manslaughter after she suffocated her husband during sex. 
",labeled-satire,"satire website published fictitious article about 480-pound woman, Annabelle Gaston. she was charged with involuntary manslaughter after husband died during sex. she was arrested last year after calling 911 when husband died.",,"In October 2019, the satire website World News Daily Report published a fictitious article about a 480-pound woman, Annabelle Gaston, who was charged with involuntary manslaughter after she accidentally suffocated her husband, Irvin Gaston.",,
52,1650725265.010143,"A giant snake skeleton, that of the extinct Titanoboa, was discovered in France on Google Maps.
",miscaptioned,"on march 24, 2022, the @googlemapsfun TikTok channel published a new video. it purportedly documented the discovery of a giant snake skeleton off the coast of France. however, this was not true.",,"On March 24, 2022, the @googlemapsfun TikTok channel published a new video. It purportedly documented the Google Maps discovery of a giant snake skeleton — that of the extinct Titanoboa — off the coast of France. However",,
53,1657124075.32376,"Members of Congress provided “reconnaissance tours” to Capitol rioters the day before the Jan. 6, 2021 insurrection. 
",mixture,"there is no evidence to confirm or disprove that the tour was given for reconnaissance purposes. the fact check was originally published on Jan. 13, 2021.",That rally preceded the attack on the Capitol. Gosar has yet to comment on the allegations.,"At least one representative gave a tour of the Capitol complex on Jan. 5, 2021, video evidence showed. According to the House Select Committee investigating the Jan. 6 Capitol attack, “some individuals” on that tour attended the",That rally preceded the attack on the Capitol. Biggs has denied any involvement with Alexander.,That rally preceded the attack on the Capitol. Gosar has yet to comment on the allegations.
54,1650750845.673767,"A photograph shows several body bags being taken out of a truck adorned with an ""Abbott 2022"" campaign slogan. 
",false,a photograph supposedly showing bodies being moved from a refrigerated mortuary truck started circulating online in august 2021. the original photograph was recirculated on social media in august 2021 after it was included in an NBC news report.,Read the latest fact checks about the vaccines.," Snopes is still fighting an “infodemic” of rumors and misinformation surrounding the COVID-19 pandemic, and you can help. Find out what we’ve learned and how to inoculate yourself against CO",Read the latest fact checks about the vaccines.,Read the latest fact checks about the vaccines.
55,1650725573.690198,"McDonald's is charging Caucasian customers a $1.50 service fee.
",false,"in 2022, an image circulated online allegedly alerting Caucasian customers of the fast food chain McDonald’s that they would be required to pay an additional fee of $1.50 per transaction. McDonald’s has no such policy, but the image appears to be a variation of a similar internet post.",,Curious about how Snopes’ writers verify information and craft their stories for public consumption? We’ve collected some posts that help explain how we do what we do. Happy reading and let us know what else you might be,,
56,1650725408.415416,"Ukrainian ambassador to the United Nations Sergiy Kyslytsya said war criminals go ""straight to hell"" when confronting his Russian counterpart.
",correct-attribution,"""there is no purgatory for war criminals. they go straight to hell,"" said the ambassador. he made the comment while confronting the russian ambassador to the u.n.","They go straight to hell,” Kyslytsya stated.","On the night of Feb. 23, 2022 (New York time), Ukraine’s ambassador to the United Nations, Sergiy Kyslytsya, had some choice words for his Russian counterpart upon receiving news that Russia had","They go straight to hell,” Kyslytsya stated.","They go straight to hell,” Kyslytsya stated."
57,1650750878.401801,"A Facebook meme accurately represents the difference in gas prices under U.S. Presidents Donald Trump and Joe Biden, with Biden's presidency and policies being the reason why prices were higher in mid-2021.
",false,"a new meme appeared to compare gasoline prices under presidents Trump and Biden. the photo on the left side of the meme, labeled “Trump,” shows a price range from $1.22 to $1.72. the photo on the right side of the meme, labeled “Biden,” likely","We were unable to find a source for the picture. However, in the end, it makes very little sense.","On Aug. 13, 2021, a new Facebook meme appeared to compare gasoline prices under U.S. Presidents Trump and Biden. The post was virally shared well over 66,000 times in just four days. In reality, this","We were unable to find a source for the picture. However, in the end, it makes very little sense.","We were unable to find a source for the picture. However, in the end, it makes very little sense."
58,1657124071.419114,"A real photograph shows Louis Armstrong playing his trumpet for his wife, Lucille Wilson, in front of the Great Sphinx and the pyramids of Giza. 
",true,"the photograph was shared in 2016 on the anniversary of Armstrong's death. the full story behind the photograph was available in the virtual exhibition section of the Louis Armstrong House Museum, located in Corona, queens.",,"His fame as a jazz musician and singer took him all over the world, including Egypt, where an iconic photograph showed Louis Armstrong serenading his wife in front of the pyramids and Great Sphinx of Giza.  The New",,
59,1650725617.810768,"Alabama was the first U.S. state to legally designate Christmas a state holiday.
",unproven,"no historical records exist to corroborate the claim about Alabama 34 years earlier. several online media outlets have presented the alleged historical fact as factual. despite the explicit lack of verification, several online media outlets have presented the purported piece of trivia as factual.",,"For more than a half-century, this persistent rumor about Christmas’ history in the United States has infiltrated literature, newspaper articles, and — more recently — the Internet: Alabama was the first state to legally recognize the day as an",,
60,1650725426.401382,"The United States airdropped pianos with parachutes to their troops during World War II in order to provide some relaxation.
",true,the first “Victory Vertical” pianos were dropped by parachute into the war zone. the pianos were manufactured by a german-american piano company. professor garik pedersen uncovered the history of the practice through his Victory Vertical Project.,"An NPR story reveals that this was indeed real. The pianos came in olive, blue, and gray drab.","Every soldier needs a reprieve from the horrors of war, and the U.S. government had an interesting method of providing that during World War II. As American soldiers faced trauma and violence, the government attempted to figure out how to","An NPR story reveals that this was indeed real. The pianos came in olive, blue, and gray drab.","An NPR story reveals that this was indeed real. The pianos came in olive, blue, and gray drab."
61,1650750804.286247,"In August 2021, Brigham Young University repeatedly washed away chalk murals containing messages of love and support for LGBT+ students.
",mixture,"a controversy emerged at byu when protesters left rainbow-themed chalk art on the sidewalk. john sutter: it’s no doubt organized, pro-LGBT+ chalk murals took place at the college. sutter: it stands to reason that BYU itself has been repeatedly washing away",,"In August 2021, a controversy emerged at Brigham Young University, when protesters, several of them alumni of the college, demonstrated in support and solidarity with LGBT+ students, leaving rainbow-themed chalk art on the sidewalk on or near campus in",,
62,1650750911.276339,"In August 2021, Netflix officially announced Catherine Zeta-Jones would star as Morticia Addams in the forthcoming series ""Wednesday.""
",true,"actress Catherine Zeta-Jones has signed on to the cast of ""wednesday"" the series centers around the Addams family’s morbid teenage daughter. the series will be directed by ""Beetlejuice"" and ""Batman Returns"" director Tim Burton.",,"In August 2021, multiple news outlets and social media posts claimed that Welsh actor Catherine Zeta-Jones had signed on to the cast of “Wednesday,” a forthcoming Netflix series that centers around the Addams family’s",,
63,1651670214.349535,"In the early-20th century, tampons were sold soaked in opium in order to relieve menstrual pain, as shown in a widely shared photograph. 
",mostly-true,"a widely shared photograph was an authentic record of a real product. a photograph of the box was included in a popular reddit post on April 27, 2022. it shows that the packaging lists ""Opium, Belladonna and Hyoscyamus""",,"A widely shared photograph was an authentic record of a real product — Pond’s medicated tampon — sold in the 1900s, which did indeed contain opium. Evidence exists that doctors did occasionally advise the use of tampons soaked",,
64,1650750711.226107,"President Joe Biden's great-great-great grandfather owned a 14-year-old Black slave in 1850. 
",true,"a rumor circulated on social media about how Joe Biden’s great-grandfather was a slave owner who fought in the confederate army. in august 2020, we received a tip that Biden’s great-great-great grandfather, a man by the name of Thomas Herbert Randle",Nothing more is needed to make this connection.,"In June 2020, a specious rumor started circulating on social media about how Democratic U.S. presidential nominee Joe Biden’s great-grandfather was a slave owner who fought in the Confederate Army. There was no truth to",Nothing more is needed to make this connection.,Nothing more is needed to make this connection.
65,1657124090.641308,"“Star Wars” creator George Lucas confirmed that the famed Millennium Falcon spaceship is visible in the 2005 film, “Star Wars Episode III – Revenge of the Sith.”
",true,"a spaceship that looks much like the Millennium Falcon can be spotted in the 2005 movie, “Star Wars Episode III – Revenge of the Sith”. the spaceship is arguably one of the most famous spaceships in film history. the confirmation of its sighting is noteworthy because the spaceship played",The TikTok video showed the moment in question. Perhaps it was revealed in a documentary?,"In June 2022, a TikTok user published a video that highlighted the fairly well known and dated fact that a spaceship that looks much like the Millennium Falcon can be spotted in the 2005 movie, “Star Wars Episode III – Revenge of",The TikTok video showed the moment in question. We’ll leave that rumor to the fans to discuss.,The TikTok video showed the moment in question. It was so old that it was no longer accessible.
66,1650724442.493605,"In 2022, Tennessee Republicans supported a piece of legislation that would legalize child marriage. 
",outdated,"in the spring of 2022, opponents of a bill introduced by Republicans in the state Legislature claimed it would “legalize child marriage” in the state. however, sponsors of the legislation introduced an amendment which explicitly stated that only adults could be married under the terms of the bill. as of April 5, 2022, marriage in the",,"In the spring of 2022, opponents of a bill introduced by Republicans in the Tennessee Legislature claimed that it would “legalize child marriage” in the state, or at the very least, remove age restrictions for marriage.  At",,
67,1650750696.364527,"A video filmed at the microscopic level shows a nanobot as it “picks up a lazy sperm by the tail and inseminates an egg with it.” 
",true,"the video was shared to twitter by the account weird science on sept. 21, 2021. it claimed the video showed a nanobot as it “picks up a lazy sperm by the tail and inseminates an egg with it” the video was also posted to reddit shortly after,","Sources Medina-Sánchez, Mariana, et al. “","A black-and-white video shared to social media showed a microscopic, corkscrew-shaped helix as it appeared to consume a sperm cell, transport it, and eventually drive the little swimmer into the wall of an immature","Sources Medina-Sánchez, Mariana, et al. “","Sources Medina-Sánchez, Mariana, et al. “"
68,1650750329.491943,"The ""Dr Pepper Corporation"" released a statement denouncing mandates for the COVID-19 vaccine. 
",false,a piece of text supposedly written by the “Dr Pepper Corporation” said it opposed mandates for the COVID-19 vaccine was recirculated on social media in 2021. the statement reads: “Dr Pepper is Texas. the Dr Pepper Corporation was established and based in the State of Texas in 1885,The statement reads: “Dr Pepper is Texas.,"In December 2021, a piece of text supposedly written by the “Dr Pepper Corporation” saying it opposed mandates for the COVID-19 vaccine was recirculated on social media:  This is not a genuine statement from the",The statement reads: “Dr Pepper is Texas.,The statement reads: “Dr Pepper is Texas.
69,1650750335.391529,"College student Morgan Vague ""lost"" to Greta Thunberg for Time Magazine's Person of the Year in 2019. 
",mostly-false,"a popular meme claims that teenage climate activist Greta Thunberg was named Time magazine’s person of the year in 2019. a spokesperson for time told us, regarding Vague, that “this a false claim” and directed us to the magazine’s reader’s poll.",Lipase is kind of like marinade on a steak.,A popular internet meme claims that teenage climate activist Greta Thunberg was named Time Magazine’s Person of the Year in 2019 despite there being a much more deserving candidate: Morgan Vague.   Vague really did successfully,Lipase is kind of like marinade on a steak.,Lipase is kind of like marinade on a steak.
